兵法id;名字;星级;等级;范围;初始攻击比例;攻击比例成长;初始防御比例;防御比例成长;初始智力比例;智力比例成长;初始伤害;伤害成长;触发几率;需求碎片;图片;图片;资源;文字描述;获取途径
bookID;bName;bStar;bLevel;bRange;bATKProportion;bATKUP;bDEFProportion;bDEFUP;bINTProportion;bINTUP;bHurt;bHurtUP;bTrigger;bFragment;bImage;bIcon;bResources;bDesc;bAccess
500001;作战篇;2;1;0;4;1;;;;;;;;;;;;孙子兵法之作战篇，将军们少年学习的课本;
500002;背水一战;3;1;0;7;2;;;;;;;;;;;;背水一战，不胜即亡，小心使用;
500003;知己知彼;4;1;0;10;3;;;;;;;;;;;;知己知彼百战百胜;
500004;九变篇;2;1;0;;;3;1;;;;;;;;;;孙子兵法之作战篇，间谍们少年学习的课本;
500005;随机应变;3;1;0;;;5;2;;;;;;;;;;女大十八变，越变越好看;
500006;励精图治;4;1;0;;;8;3;;;;;;;;;;仁者无敌，发展国力才是最大的保障;
500007;谋攻篇;2;1;0;;;;;3;1;;;;;;;;孙子兵法之谋攻篇，军师们少年学习的课本;
500008;上兵伐谋;3;1;0;;;;;5;2;;;;;;;;把敌人侃晕，降低他们的智商层次更容易赢;
500009;运筹帷幄;4;1;0;;;;;8;3;;;;;;;;运筹帷幄之中，决胜千里之外;
500010;士兵突击;2;1;1;;;;;;;12;4;15;;;;;战士们，冲啊！;
500011;精兵突袭;3;1;1;;;;;;;30;6;15;;;;;同志们，冲啊！;
500012;虎狼之军;4;1;1;;;;;;;50;28;15;;;;;冲啊，前方有美女！;
500013;骑兵出击;2;1;1;;;;;;;18;3;12;;;;;冲啊！嘚儿驾！;
500014;灵武骑射;3;1;1;;;;;;;36;6;13;;;;;赵武灵王推广的胡服骑射，极大的增强了军队战斗力;
500015;大秦铁骑;4;1;1;;;;;;;70;22;11;;;;;大秦铁骑踏平天下;
500016;暗藏甲兵;2;1;1;;;;;;;24;3;10;;;;;其实这个是请国君吃饭的时候准备的一道菜;
500017;伏兵奇袭;3;1;1;;;;;;;28;8;15;;;;;趁敌人不注意的时候突然杀出来，效果往往很好;
500018;出奇制胜;4;1;1;;;;;;;60;25;13;;;;;出其不意攻其不备，战心为上;
500019;长弓齐射;2;1;1;;;;;;;15;4;13;;;;;biu，biu，biu~~;
500020;弩箭齐射;3;1;1;;;;;;;30;8;13;;;;;突，突，突~~;
500021;百步穿杨;4;1;1;;;;;;;80;21;10;;;;;养由基的特异功能，可以射中百步外的柳树叶;
500022;城头落石;2;1;1;;;;;;;24;3;9;;;;;爬墙的时候一定要小心头顶！很可能有石头落下来;
500023;城头落木;2;1;1;;;;;;;12;3;15;;;;;爬墙的时候一定要小心头顶！很可能有木头落下来;
500024;陷马坑;2;1;1;;;;;;;18;4;12;;;;;小心脚下！特别是有古力盖的地方。;
500025;绊马索;2;1;1;;;;;;;22;4;10;;;;;小心脚下！特别是有栅栏的地方;
500026;削竹为阵;2;1;1;;;;;;;8;4;15;;;;;竹子削尖了专扎屁股;
500027;剑阵陷阱;2;1;1;;;;;;;24;4;8;;;;;帝王陵墓中最爱摆剑阵陷阱，可惜怕盗墓贼;
500028;招魂术;2;1;1;;;;;;;20;4;11;;;;;归来吧，归来呦，浪迹天涯的孤魂野鬼;
500029;六甲天兵;3;1;1;;;;;;;44;10;10;;;;;急急如律令，天兵任我调遣！;
500030;诅咒术;2;1;1;;;;;;;20;4;11;;;;;画个圈圈诅咒你！;
500031;电闪雷鸣;3;1;1;;;;;;;50;10;9;;;;;下雨天莫装逼，小心遭雷劈。;
500032;天雷击;4;1;1;;;;;;;90;20;9;;;;;老子为了对付小人专门练就的单体攻击法术;
500033;笑里藏刀;3;1;1;;;;;;;48;12;9;;;;;交朋友要小心，不要交那些只会笑的人;
500034;擒贼擒王;3;1;1;;;;;;;40;16;11;;;;;枪打出头鸟，擒贼先擒王;
500035;趁火打劫;3;1;1;;;;;;;36;18;10;;;;;当发生火灾的时候，一定要将财物抢救到自己家里;
500036;全军冲锋;3;1;2;;;;;;;18;10;10;;;;;一旦发起全军冲锋，一定不要停，以免踩踏事故发生;
500037;精兵强袭;4;1;2;;;;;;;30;16;10;;;;;兵贵精不贵多，打劫也要有文化;
500038;横扫千军;5;1;2;;;;;;;;;;;;;;在施展这一招之前，首先你需要一根足够长的棍子;
500039;马蒙虎皮;3;1;2;;;;;;;20;8;9;;;;;将老虎皮蒙在马上，专门吓唬胆小鬼;
500040;万马齐喑;4;1;2;;;;;;;36;10;8;;;;;一万匹马同时嘶鸣，胆小的能吓尿;
500041;马踏天下;5;1;2;;;;;;;;;;;;;;大秦铁骑，天下无敌;
500042;连环弩阵;4;1;2;;;;;;;32;15;10;;;;;相传是墨子发明的防御阵法，逃跑之前使用;
500043;木鸢投矢;3;1;2;;;;;;;22;12;8;;;;;鲁班发明的木鸟发射弓箭，相当于今天的直升轰炸机;
500044;转射机;3;1;2;;;;;;;24;10;7;;;;;怎么看怎么像机关枪;
500045;藉车;4;1;2;;;;;;;38;18;8;;;;;投射火炭的装甲车，专门针对爱爬城墙的;
500046;连弩车;4;1;2;;;;;;;44;20;6;;;;;加特林M1234向您报到！;
500047;飞沙走石;4;1;2;;;;;;;30;15;9;;;;;某些地区一到冬季就会出现的奇特景观;
500048;火烧连营;4;1;2;;;;;;;40;13;7;;;;;排成排，一把火，烤鸡翅膀;
500049;冰封千里;4;1;2;;;;;;;50;12;5;;;;;有了冰封千里，爸爸再也不用担心我的食物。;
500050;以逸待劳;3;1;2;;;;;;;25;16;8;;;;;守株待敌人挖坑埋自己;
500051;诡计百出;3;1;2;;;;;;;30;15;6;;;;;不作就不会死;
500052;势如破竹;2;1;3;;;;;;;15;4;12;;;;;一刀下去，咔嚓，整个世界安静了;
500053;视死如归;4;1;3;;;;;;;25;10;7;;;;;别名：《论刺客的自我修养》;
500054;易水风寒;5;1;3;;;;;;;;;;;;;;风萧萧兮易水寒，壮士一去不复还;
500055;扬马沙场;2;1;3;;;;;;;20;4;10;;;;;对于某些人，上战场跑一圈，回来就升职了;
500056;长驱直入;4;1;3;;;;;;;30;10;5;;;;;呀呀呀灭跌;
500057;魏武卒魂;5;1;3;;;;;;;;;;;;;;虽死犹生，战魂不灭;
500058;攻城锤击;3;1;3;;;;;;;12;5;10;;;;;只看到一个大锤砸过来……;
500059;云梯纵横;3;1;3;;;;;;;14;5;9;;;;;门前竖起一架云梯，蜗牛慢慢往上爬;
500060;水柱冲击;3;1;3;;;;;;;15;6;8;;;;;随时可以享受冰凉的快感;
500061;乘风破浪;3;1;3;;;;;;;17;6;8;;;;;乘风破浪会有时，有缘何惧隔千里;
500062;烈焰之击;3;1;3;;;;;;;16;5;7;;;;;5岁以下儿童请在父母知道下学习;
500063;借刀杀人;3;1;3;;;;;;;18;6;6;;;;;兄弟，借把刀使使;
500064;雷霆连击;3;1;3;;;;;;;18;7;5;;;;;请给自己预备好避雷针;
500065;冲锋陷阵;3;1;4;;;;;;;9;4;8;;;;;先让步兵们冲锋，等她们把坑填平;
500066;步步为营;4;1;4;;;;;;;15;6;6;;;;;一步一个脚印，踏实安定;
500067;百战秦英;5;1;4;;;;;;;;;;;;;;百战成兵，百变成妖，人妖;
500068;三军齐出;3;1;4;;;;;;;10;3;7;;;;;挥一挥衣袖，留下无数寡妇;
500069;强行推进;4;1;4;;;;;;;18;5;5;;;;;有困难要上，没困难，制造困难也要上;
500070;死神君临;5;1;4;;;;;;;;;;;;;;苍天呀，大地呀，来个天使姐姐帮我出口气啊;
500071;万箭齐发;3;1;4;;;;;;;12;2;6;;;;;首先，你要有一万个人;
500072;箭雨如风;4;1;4;;;;;;;20;5;4;;;;;创始人最爱刺猬，也爱看别人变成刺猬;
500073;漫天飞羽;4;1;4;;;;;;;22;4;6;;;;;一分钟，让你变鸟人，只要一分钟;
500074;钜子谋攻;5;1;4;;;;;;;;;;;;;;墨家的机关不是盖的;
500075;水淹三军;3;1;4;;;;;;;14;3;5;;;;;请注意节约用水;
500076;风卷残云;3;1;4;;;;;;;12;4;4;;;;;天上飘来五个字，那都不是事;
500077;无边落木;3;1;4;;;;;;;15;3;5;;;;;无边落木萧萧下，横的，竖的，斜的……;
500078;火箭飞蝗;4;1;4;;;;;;;25;4;5;;;;;乱扔烧烤蚂蚱，吸引敌军注意力;
500079;地动山摇;4;1;4;;;;;;;24;4;5;;;;;在岛国，常有的事情，习惯就好;
500080;飞火流星;5;1;4;;;;;;;;;;;;;;周幽王给褒姒弄的流星;
500081;风林火山;5;1;4;;;;;;;;;;;;;;其疾如风，其徐如林，侵掠如火，不动如山;
500082;望闻问切;4;1;5;;;;;;;20;20;70;;;;;扁鹊开创的中医诊断四法;
500083;妙手回春;4;1;5;;;;;;;25;20;60;;;;;妙手回春，技艺高超;
500084;莺啼燕语;4;1;5;;;;;;;25;25;55;;;;;燕语暖春姗姗至，莺啼新柳叶叶新;
500085;医国圣手;5;1;5;;;;;;;;;;;;;;扁鹊的天赋技能;
500086;如沐仙风;5;1;5;;;;;;;;;;;;;;一个美女是如沐春风，一群美女就是如沐仙风了;
500087;柔情似水;4;1;6;;;;;;;10;7;50;;;;;柔情似水可疗内伤;
500088;歌尽浮华;4;1;6;;;;;;;8;8;50;;;;;流年如水，谁负了谁一世青春无悔;
500089;百草仙;4;1;6;;;;;;;7;10;45;;;;;一种药治不好，就来100种;
